<?xml version="1.0"?>
<webapp 
  xmlns="http://www.armatiek.com/xslweb/webapp"
  xmlns:xs="http://www.w3.org/2001/XMLSchema"
  xmlns:xsi="http://www.w3.org/2001/XMLSchema-instance"
  xsi:schemaLocation="http://www.armatiek.com/xslweb/webapp ../../config/xsd/xslweb/webapp.xsd">
  
  <title>My web application</title>
  <description>My web application</description>
  <development-mode>true</development-mode>
  <max-upload-size>10</max-upload-size>
  
  <!-- Resources to serve straight away: -->
  <resources>       
    <resource pattern="/images/.+\.png" media-type="image/png"/>
    <resource pattern="/images/.+\.gif" media-type="image/gif"/>
    <resource pattern="/images/.+\.(jpg|jpeg)" media-type="image/jpg"/>
    <resource pattern="/scripts/.+\.js" media-type="text/javascript"/>
    <resource pattern="/styles/.+\.css" media-type="text/css"/>
  </resources>
  
  <parameters>
    <parameter name="my-param1" uri="http://www.armatiek.com/xslweb/configuration" type="xs:string">
      <value>my-value1</value>
    </parameter>
    <parameter name="my-param2" uri="http://www.armatiek.com/xslweb/configuration" type="xs:string">
      <value>my-value2</value>
    </parameter>
  </parameters>
  
  <jobs> 
    <!--
    <job>
      <name>MyJob</name>
      <uri>my-job.html</uri>
      <cron>0/60 * * * * ?</cron> 
      <concurrent>true</concurrent>
    </job>
    -->      
  </jobs>
  
</webapp>