<?xml version="1.0"?>
<webapp 
  xmlns="http://www.armatiek.com/xslweb/webapp"
  xmlns:xs="http://www.w3.org/2001/XMLSchema"
  xmlns:xsi="http://www.w3.org/2001/XMLSchema-instance"
  xsi:schemaLocation="http://www.armatiek.com/xslweb/webapp ../../config/xsd/xslweb/webapp.xsd">
  
  <title>XSLWeb examples</title>
  <description>XSLWeb examples</description>
  <development-mode>true</development-mode>
  <max-upload-size>10</max-upload-size> <!-- 10MB -->
  
  <!-- Resources to serve straight away: -->
  <resources> 
    <resource pattern="/(styles|images)/.+\.png" media-type="image/png"/>
    <resource pattern="/(styles|images)/.+\.gif" media-type="image/gif"/>
    <resource pattern="/(styles|images)/.+\.(jpg|jpeg)" media-type="image/jpg"/>
    <!-- Set the duration of client cache to 7 hours (default 4 hours): -->
    <resource pattern="/scripts/.+\.js" media-type="text/javascript" duration="P0DT7H0M0S"/>
    <resource pattern="/styles/.+\.css" media-type="text/css"/>
    
    <resource pattern="/downloads/.+\.docx?" media-type="application/msword"/>    
  </resources>

  <!-- Stylesheet parameters: -->
  <parameters>
    <parameter name="hostname" uri="http://www.armatiek.com/xslweb/functions/email" type="xs:string">
      <value>smtp.googlemail.com</value>
    </parameter>
    <parameter name="port" uri="http://www.armatiek.com/xslweb/functions/email" type="xs:integer">
      <value>465</value>
    </parameter>
    <parameter name="username" uri="http://www.armatiek.com/xslweb/functions/email" type="xs:string">
      <value>MYUSERNAME</value>
    </parameter>
    <parameter name="password" uri="http://www.armatiek.com/xslweb/functions/email" type="xs:string">
      <value>MYPASSWORD</value>
    </parameter>
    <parameter name="use-ssl" uri="http://www.armatiek.com/xslweb/functions/email" type="xs:boolean">
      <value>true</value>
    </parameter>
  </parameters>
  
  <!-- Scheduled job definitions: -->
  <!--
  <jobs> 
    <job>
      <name>WriteTimeJob</name>
      <uri>execute-writetime-job.html</uri>
      <cron>0/60 * * * * ?</cron>
      <concurrent>true</concurrent>
    </job>   
  </jobs>
  -->
  
  <datasources>
    <datasource>
      <name>datasource-worldcup</name>
      <driver-class>org.h2.Driver</driver-class>
      <jdbc-url>jdbc:h2:file://${webapp-dir}/xsl/relational-database/worldcup.mv</jdbc-url>
      <property name="user">sa</property>
    </datasource>
  </datasources>
  
</webapp>